{
  "kind": "judgment",
  "question": "Q3 を書き直す前に：(1)「だれが AI を起動するか」は Q0 の目的から見て正しい高さの問いか、より上位の問いに置き換えるべきか (2) Q3 を1つの論点で扱うか、「AI の判定の流れ」「Agents 契約の形」「意図の判定の記録」に分けるか (3) Q11 に足す「ワークツリーの置き場所」は目的のセッションの論点として正しい位置か",
  "premises": [
    {"name": "目的（Q0 ・ U0）", "value": "利用者が、AI に書かせた成果物を、正しいと確かめた状態で使い続ける。機械で決まるものも AI の判断が要るものも同じ契約から行い、結果は必ず5つの値のどれかで返す", "source": "ボード Q0 ・ r66-meta の前置き"},
    {"name": "起動をめぐる原本の食い違い", "value": "Q0 の details は「Agents 契約で呼ぶ AI … CLI でプロセスとして起動する」、Q11 は「AI ツールを起動するのは外（人 ・ harness）」、ACDR 0201 と model.json の入口は「semantic-* は AI を起動しない」。食い違いは Q3 の中だけでなく、決着済みの Q0 にまで及んでいる", "source": "Q0.json ・ Q11.json ・ brief.md"},
    {"name": "判定の制約（決着済み）", "value": "CI は AI に聞き直さない（I17：状態はコミットした判定の記録だけから導く）。判定させる AI は判定ごとに新しいセッションで呼ぶ。AI には値の写しだけを渡し、道具を持たせない（I14 ・ I29）。渡したものは判定した値に残す", "source": "brief.md ・ Q0 ・ Q11"},
    {"name": "ボードの開いている論点", "value": "いま開いているのは Q3（open）と Q4 protocol と外部インターフェース（waiting、Q3 に依存）の2件。上限は5件", "source": ".brainstorming/semantic-contract-core.json の topics"},
    {"name": "Q4 と Q10 の持ち物", "value": "Q4 は「要求と応答の形 ・ 版 ・ 能力の表明 … を JSON Schema で公開する」protocol を持つ。Q10 は「意味の変更は、I33 の判定の記録に残す」「判定した値が等しければ聞き直さず」を持つ", "source": "ボード Q4 ・ Q10 の answer"},
    {"name": "作業場所の記録（実装済み）", "value": "変更の記録が worktree と branch の2カラムを持ち、まとめはいまのワークツリーとブランチの記録で作る（コミット 61599f7b）", "source": "git log"},
    {"name": "未判定", "value": "(b) で作業中の AI が自分の変更を判定するとき、「判定ごとに新しいセッション」を満たすか（harness が子のセッションを新しく立てるか）は、AI ツールごとの事実で、判断基準からは決められない", "source": "判断基準の範囲外"}
  ],
  "conclusion": {
    "stance": "adopt",
    "headline": "「だれが起動するか」は手段の高さの問いなので「AI の判定を、だれが作り、何を記録に残して信頼の根拠にするか」へ上げ、Q3 はその流れの論点にして Agents 契約の形を Q4 へ、意図の判定の記録を別の論点へ分け、ワークツリーの置き場所は Q11 に足さず変更の仕組み（Q10 と Git のアダプター）側に置く",
    "because": "「だれが」は 4W の点の問いで、Q0 の目的（確かめた状態で使い続ける）へつなぐ Why が抜けている。そのため (a)(b)(c) のどれも制約（新しいセッション ・ 道具なし ・ 渡したものを残す）を満たすかで比べられず、原本どうしの食い違いが Q0 まで残っている"
  },
  "comparison": [
    {"option": "問い1：「だれが AI を起動するか」のまま (a)(b)(c) から選ぶ", "effect": "起動する者を決めても、判定の記録が何を根拠に信頼されるかは決まらない。(b) で作業した AI が自分の変更を判定すると「前の会話が結果に効かない」を破るが、この問いの立て方では検出されない", "chosen": false},
    {"option": "問い1：「AI の判定を、だれが作り、何を記録に残して信頼の根拠にするか」へ上げ、起動する者はその下の手段として選ぶ", "effect": "記録の条件（新しいセッション ・ 値の写し ・ 渡したものと任せる先を残す ・ CI は記録だけを読む）が先に決まり、(a)(b)(c) はその条件を満たすかで比べられる。Q0 の details の食い違いも同じ答えで直せる", "chosen": true},
    {"option": "問い2：Q3「エンジンの部品と Agents 契約」1つのまま書き直す", "effect": "決着済みの部品（層 ・ crate）と、まだ問題の定義が要る判定の流れが1つの答えに混ざり、見えやすい部品の側の議論が先に進む", "chosen": false},
    {"option": "問い2：Q3 を「AI の判定の流れ（起動を含む）」にし、Agents 契約の形は Q4（protocol）へ、意図の判定の記録は流れに依存する新しい論点へ分ける", "effect": "開く論点は Q3 ・ Q4 ・ 意図の判定の記録の3件で上限5件に収まる。呼び出しと答えの JSON Schema の置き場所は、すでに protocol を持つ Q4 と重複しない", "chosen": true},
    {"option": "問い3：Q11 に「ワークツリーの置き場所」を足す", "effect": "Q11 のセッションは7つの欄だけを持つと決めており、作業場所の欄を足す理由が無い。Git の具体（置き場所）が基盤のセッションの論点に入る", "chosen": false},
    {"option": "問い3：置き場所は変更の仕組み（Git のアダプターとチームのやり方）に任せ、基盤の論点は Q10 の「まとめはいまの作業場所の記録で作る」に足す", "effect": "メインのワークツリーのまとめに他の目的の書き換えが出る問題は、記録の worktree ・ branch で解ける（実装済み）。Q11 はセッションと作業場所を変更の記録でつなぐだけで済む", "chosen": true}
  ],
  "path": [
    {"ask": "問い1：「だれが AI を起動するか」はどの高さの問いか", "answer": "4W の Who で、点の問いである（five-w-one-h）。Q0 の目的へつなぐ Why（なぜその者が起動するのか）を持たないので、手段どうしを比べる基準が問いの中に無い"},
    {"ask": "問い1：その上の目的は何か", "answer": "Q0 の目的は「確かめた状態で使い続ける」で、それを支えるのは I17 の「コミットした判定の記録」である。上位の問いは「AI の判定を、だれが作り、何を記録に残して信頼の根拠にするか」になる（means-and-ends ・ two-whys）"},
    {"ask": "問い1：上げると何が見えるか", "answer": "記録が信頼されるための条件 ── 新しいセッション ・ 道具なし ・ 渡した値と任せる先を残す ── で (a)(b)(c) を比べられる。(b) は作業した AI が判定すると条件を破りうるので、harness が子のセッションを新しく立てる場合に限る、という条件が問いから出てくる（未判定の前提）"},
    {"ask": "問い1：問題解決の前に問題発見へ戻るべきか", "answer": "戻る。起動の食い違いは Q3 の中だけでなく決着済みの Q0 の details にもある。与えられた問いに答える前に、問題を「判定の記録の作り手と信頼の根拠」として定義し直す（matryoshka ・ problem-finding-and-solving）"},
    {"ask": "問い2：3つの候補は同じ高さか", "answer": "違う。「AI の判定の流れ」は問題の定義が要る側（上り）、「Agents 契約の形」と「意図の判定の記録」は流れが決まれば解ける側（下り）である。部品（層 ・ crate）は決着済みの具体で、同じ論点に混ぜると見えやすい具体の議論が先に進む（do-not-mix）"},
    {"ask": "問い2：分けた論点の置き場所は", "answer": "Agents 契約の形（call ・ results ・ needs の JSON Schema をどこに置くか）は、要求と応答の形を JSON Schema で公開する Q4 の protocol と同じ対象なので Q4 へ移す。意図の判定の記録は Q10 の「I33 の判定の記録」を深める論点で、流れの答えに依存するので新しい論点として流れのあとに開く。開く論点は3件"},
    {"ask": "問い3：「ワークツリーをどこに置くか」の Why は何か", "answer": "メインのワークツリーの変更のまとめに「記録に無い書き換え」として出ることを避けたい、である。これはセッションの問題ではなく、変更のまとめがどの作業場所の記録で作られるかの問題で、Q10（変更の仕組み）の側にある"},
    {"ask": "問い3：目的のセッションはワークツリーを持つべきか", "answer": "持たなくてよい。Q11 はセッションを7つの欄に絞っており、作業場所は変更の記録の worktree ・ branch が持つ（実装済み）。置き場所そのもの（リポジトリの外か中か）は Git のアダプターとチームのやり方に任せ、基盤の論点にしない（is-it-really-the-goal）"}
  ],
  "figure": {
    "caption": "Q0 の目的から下ろした問いの高さと、論点の置き場所",
    "nodes": [
      {"id": "goal", "label": "Q0：確かめた状態で使い続ける"},
      {"id": "trust", "label": "上位の問い：判定の記録をだれが作り、何を信頼の根拠にするか（Q3 の流れ）"},
      {"id": "who", "label": "手段：だれが AI を起動するか（a ・ b ・ c）"},
      {"id": "shape", "label": "Agents 契約の形（Q4 の protocol へ）"},
      {"id": "intent", "label": "意図の判定の記録（新しい論点）"},
      {"id": "wt", "label": "ワークツリーの置き場所（Git のアダプター ・ Q10）"},
      {"id": "q11", "label": "Q11：目的のセッション（7つの欄）"}
    ],
    "edges": [
      {"from": "goal", "to": "trust", "label": "Why で上げる"},
      {"from": "trust", "to": "who", "label": "How：条件を満たす手段を選ぶ"},
      {"from": "trust", "to": "shape", "label": "流れが決まってから解く"},
      {"from": "trust", "to": "intent", "label": "流れが決まってから解く"},
      {"from": "q11", "to": "wt", "label": "足さない。変更の記録でつなぐ", "dashed": true}
    ]
  },
  "grounds": [
    {"criterion": "five-w-one-h", "quote": "4W：When ・ Where ・ Who ・ What（いつ ・ どこで ・ だれが ・ 何を）。名詞ひとことで答えられる静的な情報で、誰の目にも見えやすい具体的な事実だが、1つひとつが独立した「点」（0次元）にすぎない。"},
    {"criterion": "five-w-one-h", "quote": "対応：システム開発では、解決策を描く前に Why を問い、目的を考える ・ 理由：Why を問わずに情報の点（4W）をつなぎ合わせても、全体を見渡した解決策は描けないから。目的を考えることが重要だと繰り返し言われるのはこのためである"},
    {"criterion": "means-and-ends", "quote": "対応：手段だけでなく、その目的を考える ・ 理由：N対1 の関係があるので、目的を考えると複数の手段が見えてきて、視野を広げて選択肢を増やす考え方につながる"},
    {"criterion": "two-whys", "quote": "対応：ユーザーの実際のユースケースを考えながら、仮説でもよいから目的を想定してみる ・ 理由：原因の Why のほうが自然に考えやすいので、あえて意識しないと未来の Why まで考えが及ばないから"},
    {"criterion": "matryoshka", "quote": "対応：問題がもう与えられているように見えても、一度話を上流に戻し、問題を定義し直してから解決に向かう ・ 理由：どんな仕事にも問題発見と問題解決の側面がある"},
    {"criterion": "problem-finding-and-solving", "quote": "観点：問題への態度 ・ 問題発見（白紙に枠を定義）：問題そのものを疑う ・ 問題解決（枠内の最適化）：問題のよしあしは疑わない"},
    {"criterion": "do-not-mix", "quote": "非対称性：「具体と抽象の非対称性」 ・ 強い側：川上より川下のほうが「硬くて強い」 ・ 放っておくとどうなるか：意識しないでいると、自然に川下側が「増殖していく」"},
    {"criterion": "is-it-really-the-goal", "quote": "対応：何から作るかの優先順位を、上位目的を指針にして付ける ・ 理由：上位目的を考えないと、優先順位が適切に付かないまま進み、余計なコストや工数がかかるから"},
    {"criterion": "user-perspective", "quote": "使い手視点：製品やシステムを、それを使う人（ユーザー）が何を実現したいかから見ること。システム開発の現場で目的を考えることは、そのまま使い手視点で考えることになる。"}
  ],
  "cautions": [
    {"name": "問い1：起動する者（Who）を先に決め、記録の信頼の条件を後回しにする", "risk": "(b) を選んだとき、作業した AI が同じ会話のまま自分の変更を判定しても、問いの中に検出する基準が無い。U0 の「確かめた状態」が作業者の自己申告になる", "alternative": "（推測）Q3 の問いを「AI の判定を、だれが作り、何を記録に残して信頼の根拠にするか」にし、記録の条件を答えの先頭に置いてから (a)(b)(c) を比べる"},
    {"name": "問い1：Q3 だけを書き直し、Q0 の details の「CLI でプロセスとして起動する」を残す", "risk": "決着済みの Q0 と新しい Q3 が食い違ったまま残り、次の書き直しで同じ食い違いがまた出る", "alternative": "（推測）Q3 の答えが決まったら、同じ回で Q0 の details の起動の行を Q3 の答えに合わせて書き直す"},
    {"name": "問い2：部品と流れを1つの論点に混ぜる", "risk": "見えやすく決着済みの層 ・ crate の議論が論点を占め、判定の流れの問題の定義が後回しになる", "alternative": "Q3 を判定の流れの論点にし、形は Q4 へ、意図の判定の記録は流れに依存する論点として分ける（判断基準 do-not-mix の「次元の異なるものとして共存させよ」に従う）"},
    {"name": "問い3：Git の具体（ワークツリーの置き場所）を基盤のセッションの論点に入れる", "risk": "基盤が Git の作法に従属し、Q0 の「Git はアダプターの1つ」と Q11 の「7つの欄だけ」が崩れる", "alternative": "（推測）置き場所はチームのやり方と Git のアダプターの説明に置き、基盤の論点は Q10 の「まとめはいまの作業場所の記録で作る」に1行足す"}
  ],
  "ai_cautions": [
    {"breaks": "Q3 を書き直したとき、Q0 ・ Q11 ・ model.json の起動の記述が新しい答えと食い違ったまま残る", "check": "ボードの JSON と model.json を「起動」「AI を起動しない」「プロセスとして起動」で grep し、Q3 の答えと逆の文が0件であることを確かめる"},
    {"breaks": "Agents 契約の形を Q3 の新しい論点として立て、Q4 の protocol と同じ JSON Schema の置き場所を2か所で答える", "check": "Q3 と Q4 の答えに call ・ results ・ needs のスキーマの置き場所が両方に書かれていないことを確かめる"},
    {"breaks": "(b) を採ったとき、判定の記録に「新しいセッションで判定したか」が残らず、CI が自己判定と区別できない", "check": "判定の記録のスキーマに任せる先とセッションの区別の欄があり、作業したセッションと同じ ID の判定を validate が受け付けないことを場面の試験で確かめる"}
  ],
  "related": [
    {"criterion": "problem-finding-and-solving", "relation": "Q3 の書き直しは、論点を開き直す「尾根」にあたる。問題の定義を先に置く"},
    {"criterion": "user-perspective", "relation": "上位の問いを、利用者（成果物を使い続ける人）から見た記録の信頼で書く"}
  ],
  "next": [
    "Q3 の問いを「AI の判定を、だれが作り、何を記録に残して信頼の根拠にするか」に書き直す",
    "記録の条件（新しいセッション ・ 道具なし ・ 渡したものと任せる先を残す ・ CI は記録だけを読む）で (a)(b)(c) を比べる",
    "Agents 契約の形（call ・ results ・ needs の置き場所）を Q4 の論点へ移す",
    "意図の判定の記録を、Q3 に依存する新しい論点として立てる",
    "Q0 の details の起動の行を Q3 の答えに合わせて書き直す",
    "ワークツリーの置き場所を Q11 に足さず、Q10 に「まとめはいまの作業場所の記録で作る」を足す"
  ]
}
